{
  "id": "20260623-implementa-fase-5-com-avatar-3d-e-cerebro-cosmico",
  "type": "added",
  "summary": "Implementa Fase 5 com avatar 3D procedural e cerebro cosmico.",
  "details": [
    "Avatar Studio adiciona roupas, cabelo, olhos, acessorios, cores e Minha Skin persistida por usuario.",
    "Analise local de imagem extrai paleta visual no navegador e sugere adaptacao propria para o avatar sem enviar dados externos.",
    "Modo Cerebro ganha visual cosmico, nos de memorias, documentos e aprendizado, alem dos modos Performance, Equilibrado e Ultra Visual."
  ],
  "date": "2026-06-23",
  "version": null
}
