{
  "id": "20260703-adiciona-fase-visual-2-0-com-portfolio-e-cerebro-premium",
  "type": "added",
  "summary": "Adiciona Fase Visual 2.0 com Portfolio e cerebro premium",
  "details": [
    "Cria modo Portfolio na PWA com sidebar, ajustes rapidos, comandos de chat e animacoes GSAP opcionais.",
    "Reforca o Cerebro Cosmico com sulcos neurais, fragmentos holograficos e fallback Canvas preservado.",
    "Documenta GSAP, Portfolio e plano futuro GLB/VRM sem remover funcionalidades existentes."
  ],
  "date": "2026-07-03",
  "version": null
}
